"organization_id","name"
"24405","American Society for Deaf Children"
"24406","National Association of the Deaf"
"24411","National Association of State Head Injury Administrators"
"24412","Food Allergy & Anaphylaxis Network"
"24415","Professional Services Council"
"24416","SHEET METAL AND AIR CONDITIONING CONTRACTORS' NATIONAL ASSOCIATION"
"24417","Finishing Contractors Association"
"24418","Center for Healthy Aging"
"24420","Association of Maternal and Child Health Programs"
"24421","American Society of Radiologic Technologists"
"24423","Society for Vascular Ultrasound"
"24424","Medical Dosimetrist Certification Board"
"24426","American College of Medical Physics"
"24428","Sigfried USA"
"24430","Synthetic Organic Chemical Manufacturer Organization"
"24431","National Propane Gas Association"
"24434","Energy Sciences Coalition"
"24435","National Healthy Start Association"
"24437","Global Health Council"
"24438","Friends of the Global Fight"
"24439","Global AIDS Alliance"
"24441","National Religious Campaign Against Torture"
"24442","Islamic Society of North America"
"24444","Fuller Theological Seminary"
"24445","Carolina Peace Resource Center"
"24448","Grande Ronde Model Watershed"
"24451","Ice Age Floods Institute"
"24452","Paleozoic Trackways Foundation"
"24454","Act Against Torture"
"24456","Campaign for Justice"
"24458","International Sleep Products Association"
"24460","National Alliance to End Sexual Violence"
"24463","National Research Center for Women & Families"
"24468","Healthy Schools Network, Inc."
"24469","Nevada Cancer Institute"
"24470","American Society of Heating, Refrigerating and Air-Conditioning Engineers"
"24473","National Consumers League"
"24477","Center for Environmental Health"
"24478","Center for Health, Environment and Justice"
"24480","Healthy Child Healthy World"
"24488","Association of National Advertisers"
"24490","National Lumber and Building Materials Dealers Association"
"24494","Manufacturing Jewelers & Suppliers of America"
"24495","Society of Glass and Ceramic Decorators"
"24496","Los Caminos Antiguos Scenic & Historic Byway"
"24497","Juvenile Products Manufacturers Association"
"24499","Association of Home Appliance Manufacturers"
"24504","National Paint & Coatings Association"
"24505","Air-Conditioning, Heating, and Refrigeration Institute"
"24506","Soap and Detergent Association"
"24509","National Association of Regulatory Utility Commissioners"
"24511","American Home Furnishings Alliance"
"24514","Consumer Specialty Products Association"
"24515","Information Technology Industry Council"
"24516","Fashion Jewelry Trade Association"
"24517","Window Covering Safety Council"
"24518","Window Covering Manufacturers Association"
"24522","Early Childhood Investment Corporation"
"24523","Mothering Magazine"
"24524","National School Supply and Equipment Association"
"24525","Renal Support Network"
"24527","Stand Up for Veterans"
"24529","Direct Marketing Association"
"24530","Partnership for the National Trails System"
"24535","Black Leadership Forum"
"24536","Joint Ocean Commission Initiative"
"24537","American Brain Coalition"
"24538","Epilepsy Foundation"
"24539","National Association of Councils on Developmental Disabilities"
"24541","National Disability Rights Network"
"24542","North American Brain Injury Society"
"24544","United Cerebral Palsy"
"24545","Consortium for Ocean Leadership"
"24547","American Medical Student Association"
"24548","University Coalitions for Global Health"
"24549","Africa Action"
"24550","General Board of Church and Society"
"24554","National Neighborworks Association"
"24555","Opportunity Finance Network"
"24556","Investment Company Institute"
"24561","Footwear Distributors and Retailers of America"
"24562","Travel Goods Association"
"24564","Business & Institutional Furniture Manufacturers Association"
"24569","Great Lakes Commission"
"24570","Marine Technology Society"
"24571","Association of American Publishers"
"24578","Alzheimer's Association"
"24580","National Whistleblower Center"
"24581","International Association of Amusement Parks and Attractions"
"24582","themiddleclass.org"
"24583","National Motorists Association"
"24585","Southern California Coastal Ocean Observing System"
"24586","Safe Hospitals Now"
"24587","Federally Employed Women"
"24588","Forging Industry Association"
"24590","National Council of Textile Organizations"
"24592","China Currency Coalition"
"24594","Immigration Policy Center"
"24598","The Confederated Tribes of Warm Springs Reservation of Oregon"
"24599","Clackamas County Board of Commissioners"
"24601","Historic Chattahoochee Commission"
"24602","Outdoor Industry Conservation Alliance"
"24603","International Mountain Bicycling Association"
"24604","National Washington-Rochambeau Revolutionary War Route Association"
"24605","Dobbs Ferry Historical Society"
"24606","Democratic Underground"
"24607","General Federation of Women's Clubs"
"24610","US Army Center of Military History"
"24615","Americans for Responsible Recreational Access"
"24616","Klymazzation Motorsports"
"24617","Long Beach Water Department"
"24618","VoteTrust USA"
"24621","American Hiking Society"
"24624","Automotives Recyclers Association"
"24625","Society of Collision Repair Specialists"
"24627","International Alzheimers Organization"
"24628","Alliance for Aging Research"
"24629","Alzheimers Foundation of America"
"24630","American Geriatrics Society"
"24631","National Adult Day Services Association"
"24633","National Council of Womens Organizations"
"24634","Unitarian Universalist Association of Congregations"
"24636","Virgina Forest Watch"
"24645","Change to Win"
"24650","National Sunflower Association"
"24654","American Frozen Food Institute"
"24656","National Wild Turkey Federation"
"24657","National Confectioners Association"
"24658","American Meat Institute"
"24659","Virginia Wilderness Committee"
"24660","National Association of Student Financial Aid Administrators"
"24662","YKASEC"
"24663","Justice For Immigrants"
"24664","Society of American Florists"
"24665","National Immigrant Justice Center"
"24666","Minority Executive Directions Coalition"
"24670","American Jewish Committee"
"24675","American Health Quality Association"
"24681","National Small Town Alliance"
"24684","Hidradenitis Suppurativa Foundation"
"24685","HS-USA"
"24690","United States Conference of Catholic Bishops"
"24701","Washington Fair Trade Coalition"
"24703","American Association of State Colleges and Universities"
"24707","American Jewish World Service"
"24708","Usability Professionals' Association"
"24709","Hood River Valley Residents Committee"
"24710","Friends of the Columbia Gorge"
"24717","Reinsurance Association of America"
"24718","Independent Insurance Agents & Brokers of America"
"24719","Feminists for Life of America"
"24720","Students for Life of Michigan"
"24722","The HSA Coalition"
"24723","Oregon Water Resources Congress"
"24727","National Association of Insurance and Financial Advisors"
"24728","Heal the Bay"
"24733","National Association of Letter Carriers"
"24734","Credo Action"
"24735","Vote PA"
"24736","Brennan Center for Justice"
"24737","Coalition for Peace Action"
"24738","Association for Computing Machinery"
"24744","Electronic Industries Alliance"
"24745","Gynecologic Cancer Foundation"
"24746","National Society of Professional Engineers"
"24752","American Motorcyclist Association"
"24754","American Society for Therapeutic Radiology and Oncology"
"24755","Ovarian Cancer National Alliance"
"24756","Military Order of the Purple Heart"
"24758","American Securitization Forum"
"24759","Thacher Proffitt & Wood, LLP"
"24761","TargetGov"
"24765","National Association of Professional Insurance Agents"
"24769","National Women's Health Network"
"24770","Spastic Paraplegia Foundation"
"24771","Coalition for a Competitive Pharmaceutical Market"
"24773","National Organization for Rare Disorders"
"24775","Momenta Pharmaceuticals"
"24776","Ford Motor Company"
"24779","Coalition for Safe and Innovative Medicine"
"24780","Candlelighters Childhood Cancer Foundation"
"24781","American Society of Clinical Oncology"
"24782","US Rice Producers Associations"
"24783","U.S. Grains Council"
"24784","National Trust for Historic Preservation"
"24789","Center For Children's Law and Policy"
"24795","Interlocking Concrete Pavement Institute"
"24796","Mason Contractors Association of America"
"24800","Steel Shipping Container Institute"
"24802","National Organization of Women"
"24804","Cystic Fibrosis Foundation"
"24805","National Defense Industrial Association"
"24809","College and University Professional Association for Human Resources"
"24810","FORCE: Facing Our Risk of Cancer Empowered"
"24812","Affymetrix"
"24813","American Society of Human Genetics"
"24814","National Workrights Institute"
"24815","National Society of Genetic Counselors"
"24818","American Academy of Physician Assistants"
"24820","American Diabetes Association"
"24821","American Institute for Medical and Biological Engineering"
"24822","American Nurses Association"
"24825","Sarah Lawrence College"
"24827","American Academy of Actuaries"
"24830","Arizona Office of Tourism"
"24831","National Business Travel Association"
"24834","National Business Group on Health"
"24836","American Institute of Architects"
"24838","Affordable Housing Tax Credit Coalition"
"24839","Bank of America"
"24841","Heritage Consulting Group"
"24845","Main Street Mortgage Company"
"24847","Business-Higher Education Forum"
"24850","National Emergency Management Association"
"24856","National Association of Real Estate Investment Trusts"
"24860","Puerto Rico Federal Affairs Administration"
"24863","National Business Aviation Association"
"24864","American Council of Engineering Companies of colorodo"
"24866","American Composite Manufacturers Association"
"24868","Corn Refiners Assoiation"
"24870","Building Owners and Managers Association International"
"24872","National Industrial Sand Association"
"24873","National Oilseed Processors Association"
"24874","National Roofing Contractors Association"
"24876","Textile Rental Services Association of America"
"24880","Retail, Wholesale and Department Store Union"
"24883","United Support & Memorial For Workplace  Fatalities"
"24891","Insitute of Real Estate Management"
"24895","The Crohn's and Colitis Foundation of America"
"24896","North American Society for Pediatric Gastroenterology, Hepatology and Nutrition"
"24897","Association of Americans Resident Overseas"
"24900","American Public Power Association"
"24903","National Rural Electric Cooperative Association"
"24904","Farm and Ranch Guide"
"24905","American Forest and Paper Association"
"24906","Consumers United for Rail Equity"
"24907","American Legion Family"
"24909","Veterans Resources"
"24910","American Legion Department of Washington"
"24912","Preservation Maryland"
"24913","National Conference of State Historic Preservation Officers"
"24922","Governor Martin OMalley"
"24923","Mayor Adrian Fenty"
"24927","National Archives and Records Administration"
"24930","Illustrators' Partnership of America"
"24933","National Guard Association of the United States"
"24935","Recording Industry Association of America"
"24941","InterActiveCorp"
"24942","National Black Chamber of Commerce"
"24951","Democracy Matters"
"24952","Americans for Campaign Reform"
"24953","Fair Elections Now Coalition"
"24954","Campaign for America's Future"
"24958","American Land Title Association"
"24960","Conference of State Bank Supervisors"
"24968","National Coalition on Black Civic Participation"
"24969","Dolores C. Huerta Foundation"
"24972","Nucor Corporation"
"24977","Volunteers of America"
"24978","Partnership to End Long-Term Homelessness"
"24983","American Council for Capital Formation"
"24985","Nuclear Information and Resource Service"
"24987","Animal Agriculture Alliance"
"24988","Dairy Farmers of America"
"24989","U.S. Canola Association"
"24992","Center for Corporate Policy"
"24997","Advertising Photographers of America"
"24999","Farm Credit Services of America"
"25001","American Meat Goat Association"
"25003","Associated Milk Producers, Inc"
"25004","Farm Credit Council"
"25005","Crop Insurance Research Bureau"
"25007","Federal Law Enforcement Officers Association"
"25009","National Hydropower Association"
"25010","Air Conditioning Contractors of America"
"25011","Association of Educational Publishers"
"25015","Solar Nation"
"25019","National Cooperative Grocers Association"
"25022","Mary Lee Foundation"
"25023","School Nutrition Association"
"25028","Share Our Stregth"
"25029","Supervalu"
"25031","Autism Speaks"
"25036","The Association of Equipment Manufacturers"
"25037","The Addiction Care Center of Albany"
"25039","Migrant Legal Action Program"
"25040","Michigan Bean Shippers"
"25042","Maersk Line, Limited"
"25043","Massachusetts Law Reform Institute"
"25045","Kalamazoo Loaves and Fishes"
"25050","Cape Cod Cranberry Growers Association"
"25051","California School Employees Association"
"25052","American Grassfed Association"
"25053","Cotton Warehouse Association of America"
"25054","Association of Flight Attendants"
"25055","Teen Advocates USA"
"25056","National Association of Therapeutic Schools and Programs"
"25057","National Association of County Behavioral Health & Developmental Disability Directors"
"25058","Campaign for Tobacco-Free Kids"
"25059","New York Association of Convenience Stores"
"25060","Business Alliance for Northeast Mobility"
"25061","Alliance for Patient Access"
"25062","American Association of Childrens Residential Centers"
"25063","Public Sector HealthCare Roundtable"
"25066","Friends of Brad Will"
"25067","Global Exchange"
"25068","Association of Professional Flight Attendants"
"25069","Center for International Policy"
"25075","American Association of Airport Executives"
"25083","Hospira"
"25084","Humana"
"25086","National Association of Chain Drug Stores"
"25087","Ranbaxy Pharmaceuticals Inc."
"25094","Tekgenics Corporation"
"25095","Insmed Incorporated"
"25096","United Airlines"
"25097","International Association of Emergency Managers"
"25099","Ports Association of Louisiana"
"25100","Offshore Marine Service Association"
"25101","Northeast States for Coordinated Air Use Management"
"25102","National Association of Clean Air Agencies"
"25103","American Coalition for Fathers and Children"
"25106","National Center on Domestic and Sexual Violence"
"25108","Family Violence Prevention Fund"
"25109","National Council of Juvenile and Family Court Judges"
"25110","Legal Resource Center on Violence Against Women"
"25111","National Domestic Violence Hotline"
"25112","Jim Surkamp, County Commissioner, Jefferson County, WV"
"25116","Heritage Development Institute"
"25117","Appalachian Regional Commission"
"25119","American Forest Resource Council"
"25120","Nature Conservancy"
"25126","Mississippi Development Authority"
"25127","The Blues Highway Association"
"25128","Baltimore Area Convention and Visitors Association"
"25129","BoatBlue"
"25133","BlueRibbon Coalition"
"25138","Northwest Interstate Compact on Low-Level Radioactive Waste Management"
"25141","Utah Radiation Control Board"
"25143","Utah Governor Jon Huntsman"
"25144","Alliance for Nuclear Responsibility"
"25146","American Maritime Officers"
"25147","National Association of Conservation Districts"
"25148","ISTA Pharmaceuticals"
"25149","MedImmune Vaccines"
"25154","Mayor Gayla Brumfeld, Clovis, NM"
"25155","Sangamo Biosciences"
"25156","ARYx Therapeutics"
"25157","Greenpeace"
"25160","Calpine"
"25161","Environmental Defense Fund"
"25167","Owyhee Cattlemen's Association"
"25170","American Sportfishing Association"
"25171","Alliance for the Great Lakes"
"25173","Great Lakes Sport Fishing Council"
"25174","US Sailing"
"25175","Save Orphan Works"
"25177","The Artists Foundation"
"25178","National Press Photographers Association"
"25179","American Society of Media Photographers"
"25180","Society of Photographers and Artists Representatives"
"25182","Future of Music Coalition"
"25185","American Federation of Government Employees"
"25186","Californians Aware"
"25188","CorpWatch"
"25190","National Air Carrier Association"
"25191","Cargo Airline Association"
"25192","Fund for Constitutional Government"
"25195","National Security Archive"
"25197","National Parks Conservation Association"
"25202","Amgen"
"25203","Elan Corporation"
"25208","Abbott Diabetes Care"
"25209","Allergan"
"25210","American Coalition for Clean Coal Electricity"
"25212","Catalyst Paper Corporation"
"25215","Tetra Pak"
"25216","Xanterra Parks & Resorts"
"25218","Wild Virginia"
"25220","Community Development Venture Capital Association"
"25221","National Alliance of Community Economic Development Associations"
"25222","Weyerhaeuser Company"
"25225","Western Lands Project"
"25227","Western Watersheds Project"
"25231","Children's Cause for Cancer Advocacy"
"25233","NanoBusiness Alliance"
"25234","Enterprise Community Partners"
"25235","National Association of Affordable Housing Lenders"
"25236","Enterprise Corporation of the Delta"
"25238","Local Initiatives Support Corporation"
"25242","Community Preservation Corporation"
"25243","National Association of State and Local Equity Funds"
"25244","International Economic Development Council"
"25245","Freddie Mac"
"25247","New Jersey Department of Health and Senior Services"
"25248","Robert Wood Johnson Foundation"
"25251","Service Employees International Union (SEIU)"
"25252","National Association of Convenience Stores"
"25253","U.S. Secretaries of Health, et al."
"25256","Privacy International"
"25260","Washington Coalition for Open Government"
"25261","Cure Search National Childhood Cancer Foundation"
"25262","The Project on Emerging Nanotechnologies"
"25263","American Chemistry Council"
"25265","Texas Instruments"
"25266","California Farm Bureau Federation"
"25268","National Council of Farmer Cooperatives"
"25269","National Association of Consumer Bankruptcy Attorneys"
"25271","St. Gabriel Possenti Society, Inc"
"25272","American Association for Respiratory Care"
"25273","American Lung Association"
"25274","Dosal Tobacco Corporation"
"25276","North Atlantic Trading Company Inc."
"25277","Prime Time International Company"
"25278","Swedish Match"
"25279","National African American Tobacco Prevention Network"
"25280","Reynolds American Inc."
"25283","Save Small Business"
"25284","Fashion Model Fairness Project"
"25285","Sullivan & Worcester LLP"
"25286","Southern Illinois and Southwest Indiana Respiratory Clinic"
"25287","American Wholesale Marketers Association"
"25288","National Association of Tobacco Outlets"
"25290","Esperanza"
"25291","First Star"
"25292","Allianz of America Corporation"
"25294","National Space Society"
"25296","Jewish Community Relations Council of Minnesota and the Dakotas"
"25297","Ball Aerospace & Technologies Corporation"
"25298","Cessna"
"25300","Bombardier Business Aircraft"
"25303","Alliance for Health Economic and Agriculture Development"
"25305","Consuming Industries Trade Action Coalition"
"25306","American Herbal Products Association"
"25308","Baltimore Jewish Council"
"25309","Automotive Trade Policy Council"
"25310","Vitamin Research Products"
"25312","Natural Products Association"
"25315","The Heartland Institute"
"25317","Visual Arts Alliance"
"25318","American Electronics Association"
"25320","Automotive Aftermarket Industry Association"
"25322","Discover Financial Services"
"25324","Financial Services Forum"
"25325","Motor and Equipment Manufacturers Association"
"25326","National Electronic Distributors Association"
"25328","International Trademark Association"
"25331","Underwriters Laboratories Inc."
"25332","Industrial Fasteners Institute"
"25334","Granite State Independent Living"
"25335","Association of University Centers on Disabilities"
"25337","NBC Universal"
"25339","World Institute on Disability"
"25342","American Federation of Musicians"
"25343","National Breast Cancer Coalition"
"25345","Toxics Information Project"
"25346","Women of Reform Judaism"
"25347","Association of Women's Health, Obstetrics and Neonatal Nurses"
"25348","Komen for the Cure: Advocacy Alliance"
"25350","Association of the United States Army"
"25351","National Prostate Cancer Coalition"
"25352","Air Line Pilots Association"
"25353","American Iron and Steel Institute"
"25355","United States Merchant Marine Academy Mid-Atlantic Parents' Club"
"25357","Activistas"
"25359","U.S. Department of Energy"
"25360","Securing America's Future Energy"
"25362","Exelon Corporation"
"25363","American Academy of Child and Adolescent Pyschiatry"
"25364","Community Oncology Alliance"
"25365","Oklahoma Society of Clinical Oncology"
"25366","Muscle Shoals Regional Center at the University of North Alabama"
"25368","Florida Society of Clinical Oncology"
"25369","Airline Pilots Against Age Discrimination"
"25370","New Mexico Society of Clinical Oncology"
"25371","Public Lands Advocacy"
"25372","Citi Cards"
"25374","The Lattice Group"
"25375","Institute for Women's Policy Research"
"25376","Senior Pilots Coalition"
"25377","American College of Radiology"
"25378","Association of Research Libraries"
"25380","National Employment Law Project"
"25381","Louisiana State Medical Society"
"25384","Washington State Employment Security Department"
"25386","Academy of Managed Care Pharmacy"
"25387","Copyright Alliance"
"25388","American Society of Anesthesiologists"
"25389","Amnesty International"
"25390","Association of Public Television Stations"
"25391","NetCoalition"
"25393","Georgia Mental Health Consumer Network"
"25394","Kidney care Partners"
"25398","AmerIcan Nephrology Nurses' Association"
"25399","Mental Health Liaison Group"
"25400","American Kidney Fund"
"25402","Dialysis Patients Citizens"
"25403","Center for Borderline Personality Disorder/Self-Injury"
"25404","Digital Media Association"
"25405","Internet Commerce Coalition"
"25406","Directors Guild of America"
"25407","American Federation of Television and Radio Artists"
"25408","Office and Professional Employees International Union"
"25409","Families for Freedom"
"25410","Political Affairs Magazine"
"25411","Communist Party USA"
"25412","La Raza Nueva"
"25413","Indymedia"
"25414","National Korean American Service & Education Consortium"
"25415","German American Internee Coaliation"
"25416","Psoriasis Cure Now"
"25417","National Psoriasis Foundation"
"25419","Lupus Foundation of America"
"25420","Association of Community Organizations for Reform Now"
"25424","Visiting Nurse Associations of America"
"25425","American Academy of Ophthalmology"
"25426","Americal Clinical Laboratory Association"
"25427","Real Estate Roundtable"
"25430","Richard Simmons"
"25432","Library Copyright Alliance"
"25434","Entertainment Consumers Assocation"
"25435","National Campaign for Fair Elections"
"25437","National Music Publishers' Association"
"25439","Grand County, Utah"
"25440","National Council for Geographic Education"
"25443","Military Retiree Grass Roots Group"
"25445","Inter-American Entrepreneurs Association in Puerto Rico"
"25448","Puerto Rico Bar Association"
"25449","Puerto Rico Teachers Association"
"25450","Puerto Ricans for Free Association and Social Justice"
"25452","National Kidney Foundation"
"25455","Mayor Michael R. Bloomberg"
"25456","Industrial Energy Consumers of America"
"25458","Environmental Law and Policy Center"
"25459","International Chiropractors Association"
"25462","Life Extension Foundation"
"25464","American Wind Energy Association"
"25465","Avista"
"25466","Association for Community Affiliated Plans"
"25468","Cabot Fuel Cells"
"25473","North American Insulation Manufacturers Association"
"25474","American Society of Nephrology"
"25475","American Gastroenterological Association"
"25477","Congress of Neurological Surgeons"
"25478","United Families International"
"25481","Equal Rights Washington"
"25483","Global Green USA"
"25487","New York Mercantile Exchange (NYMEX)"
"25489","Small Business Majority"
"25490","My Rural America"
"25492","A. O. Smith Corporation"
"25493","Abbott Laboratories"
"25494","Advanced Micro Devices"
"25495","Advantage Capital Partners"
"25497","Agilent Technologies, Inc."
"25498","Air Products and Chemicals"
"25499","Altria Group"
"25502","ATAS"
"25503","ATEECO"
"25504","Autodesk"
"25506","BAE Systems"
"25507","Batesville Tool & Die"
"25509","Borel Private Bank & Trust Company"
"25511","Case New Holland"
"25512","Chubb Corporation"
"25516","Coca-Cola Company"
"25517","ConAgra"
"25518","Con-Way"
"25520","Devine Tarbell & Associates"
"25521","DIAB"
"25522","Empire Broadcasting"
"25523","Alliance for Worker Freedom"
"25524","Americans for Prosperity"
"25525","Federally Employed Women Rocky Mountain Region"
"25526","Extol International"
"25527","FileMaker"
"25528","Fredon Corporation"
"25530","Physician Hospitals of America"
"25532","Genworth Financial"
"25533","Gilead Sciences"
"25534","GMAC"
"25535","Goldman Sachs"
"25538","Griffin Realty Advisors"
"25539","Harley-Davidson Motor Company"
"25544","Intevac"
"25545","JDS Uniphase Corporation"
"25547","Key Bank"
"25548","Security on Campus Inc."
"25550","LibraryWorld, Inc"
"25551","Lincoln Financial"
"25552","Campus Justice"
"25553","Lockheed Martin"
"25555","Equality for Adopted Children"
"25556","Student Press Law Center"
"25557","American College of Rheumatology"
"25558","Arthritis Foundation"
"25559","Maxim Integrated Products"
"25560","Association of Rheumatology Health Professionals"
"25561","McCormick & Company"
"25562","Change.org"
"25564","Monsanto Company"
"25565","Physicians for Human Rights"
"25567","PEN American Center"
"25568","New Leaf Paper"
"25569","News Corporation"
"25570","Northrop Grumman"
"25571","Multifaith Voices for Peace and Justice"
"25572","Community Alliance for the Ethical Treatment of Youth"
"25574","National Child Abuse Coalition"
"25575","Voices for America's Children"
"25579","Oracle Corporation"
"25580","Palm, Inc."
"25581","Procter & Gamble"
"25582","Rath, Young and Pignatelli"
