"organization_id","name"
"17715","Covanta Energy (unless amended)"
"17716","Community Renewable Energy Services"
"17717","Enpower Corporation"
"17718","Global Power Company"
"17720","Minnesota Methane"
"17721","Mt. Poso Congeration Company"
"17722","The Utility Reform Network (TURN) (unless amended)"
"17723","Wheelabrator Environmental Systems"
"17724","Los Rios Community College District (sponsor of funeral embalming language)"
"17725","California Agricultural Commissioners and Sealers Association (sponsor of weights and measures language)"
"17726","State Association of County Auditors [SPONSOR]"
"17728","Alameda County Board of Supervisors (co-sponsor)"
"17729","Solano County Board of Supervisors (co-sponsor)"
"17731","Breast Cancer Action (co-source)"
"17733","Asian Communities for Reproductive Justice (ACRJ)"
"17734","Awakening Spirit Aroma Therapy & Herbal Products"
"17735","Birth Defect Research for Children (BDRC)"
"17736","California Black Women's Health Project"
"17737","California Council of Churches (Church IMPACT)"
"17738","California Interfaith Partnership for Children's Health and the Environment"
"17739","California League for Environmental Enforcement Now (CLEEN)"
"17740","California National Organization for Women (CANOW)"
"17741","California Women Lawyers (CWL)"
"17742","Cancer Prevention Coalition, Los Angeles"
"17743","Cancer Research Center of America, Inc."
"17744","Carrot Tree Soaps and Essentials"
"17745","City of Vacaville"
"17746","Clearly Natural"
"17747","Congregation Beth Israel Social Action Committee"
"17748","DES Action"
"17749","Dr. Bronner's Magic Soaps"
"17750","Ecco Bella"
"17751","Ecumenical Council of San Diego County"
"17752","Environmental Health Network (EHN)"
"17753","Environmental Justice Coalition for Water (EJCW)"
"17754","Fragranced Products Information Network"
"17755","Health Care Without Harm"
"17756","Integral Sense Brands"
"17757","Latina Breast Cancer Agency (LBCA)"
"17758","Lymphoma Foundation of America"
"17759","Marin Cancer Project"
"17760","National Council of Catholic Women (NCCW) - Province of San Francisco"
"17762","Orange County Interfaith Coalition for the Environment (OCICE)"
"17763","Osea International"
"17766","Plantlife, Inc."
"17767","Presbyterians for Restoring Creation"
"17768","Region 8 States Council of the United Food & Commercial Workers (UFCW)"
"17769","Sanitation Districts of Los Angeles County"
"17770","Santa Clara Center for Occupational Safety and Health (SCCOSH)"
"17771","Science and Environmental Health Network"
"17773","Strategic Actions for a Just Economy (SAJE)"
"17774","TerrEssentials"
"17777","Women's Cancer Resource Center (WCRC)"
"17778","Women's Foundation of California"
"17779","Women's Voice for the Earth"
"17780","Alticor, Inc."
"17781","Chemical Instury Council of California (CICC)"
"17783","CosmaLabs International, LLC"
"17784","Cosmetic, Toiletry and Fragrance Association (CTFA)"
"17785","Creative Nail Design"
"17786","Elizabeth Arden"
"17790","Merle Norman Cosmetics"
"17793","Parnell Pharmaceuticals, Inc."
"17795","Shaklee Corporation"
"17796","T. Hasegawa USA Inc. Flavors and Fragrances"
"17798","California/Nevada Community Action Partnership"
"17799","Community Action Partnership, Riverside County"
"17800","Food Share, Inc."
"17801","HRC Food Bank"
"17802","JERICHO, a Voice for Justice"
"17803","Kern Food Bank"
"17804","Second Harvest Food Bank of Santa Cruz & San Benito Counties"
"17805","Bob Link, Mayor, City of Visalia"
"17807","California State University, Sacramento, Women's Resource Center"
"17808","Family Law Section of State Bar"
"17809","National Organization for Women, San Gabriel Valley/ Whittier Chapter"
"17810","California Teamsters Public Affiars Council"
"17812","Breast Cancer Action (cosponsor)"
"17813","American Public Information on the Environment"
"17814","California Inerfaith Partnership for Children's Health and the Environment"
"17815","Cancer Research Center of America"
"17816","Children's Health Environmental Coalition"
"17818","National Coalition of the Chemically Impaired"
"17819","Orange County Interfaith Coalition for the Environment"
"17820","Plantlife"
"17821","Southern California Coalition on Occupational Safety and Health"
"17823","Women's Cancer Resource Center"
"17824","Cosmetic, Toiletry, and Fragrance Association"
"17825","Placer County and Fresno County Boards of Supervisors"
"17826","City of Alameda (sponsor)"
"17827","West Alameda Business Association"
"17829","CA State Sheriffs' Association [SPONSOR]"
"17830","Counties of: San Mateo, Santa Cruz, and Tulare"
"17831","Imperial County Sheriff's Office"
"17832","Kern County Sheriff's Department"
"17835","Ventura County Sheriff's Department"
"17836","Yolo County Sheriff's Department"
"17837","Alameda County Congestion Management Agency (co-sponsor)"
"17838","Alameda County Transportation Improvement Authority (co-sponsor)"
"17839","Santa Clara Valley Transportation Authority (co-sponsor)"
"17840","San Diego Association of Governments (co-sponsor)"
"17841","California Alliance for Jobs"
"17842","San Joaquin Regional Rail Commission"
"17843","California National Guard Association"
"17844","Metropolitan Education District (sponsor)"
"17845","California Association of Regional Occupational Centers and Programs"
"17846","Southern California Regional Occupational Center"
"17847","Los Angeles County Sheriff's Department (sponsor)"
"17848","Department of Motor Vehicles (sponsor)"
"17849","San Pedro and Peninsula Homeowners' Coalition"
"17850","Republican Womens Caucus"
"17851","Regional Council of Rural Counties (Sponsor)"
"17852","California Radiological Society"
"17853","Bret Harte Elementary School"
"17854","Franklin School, Modesto, California"
"17855","Associated Builders and Contractors of California (sponsor)"
"17856","Engineers & Scientists of California, Local 20"
"17857","Community Alliance with Family Farmers (Sponsor)"
"17858","Deposition Reporters Association of California (Sponsor)"
"17859","Californians for Quality Local Corrections"
"17860","Los Angeles Probation Officers' Union, AFSCME, Local 685"
"17861","Sacramento County Sheriff's Department"
"17862","Suzie Cohen and Associates, Inc."
"17863","Tulare County Health and Human Services Department (sponsor)"
"17864","John Haramalis, President National Guard Assocation"
"17865","Bill Reese, President CST soldiers and Airman Association, Sponsor"
"17866","Four Members of the 95th Civil Support Team"
"17867","Association of Competitive Technology"
"17869","International Warehouse Logistics Association"
"17870","NetChoice Coalition"
"17871","North American Association of Food Equipment Manufacturers"
"17872","Software Finance & Tax Executives Council"
"17873","Secretary of State (sponsor)"
"17874","California Assisted Living Association (support if amended)"
"17875","City of Arcadia Fire Department"
"17876","City of Carlsbad Fire Department"
"17877","City of Coronado Fire Department"
"17878","City of South Pasadena"
"17879","City of West Sacramento Fire Department"
"17880","Manhattan Beach Fire Department"
"17881","Napa City Fire Department"
"17883","Sacramento Valley Fire Prevention Officers Association"
"17884","San Gabriel Fire Department"
"17885","San Ramon Valley Fire Protection District"
"17886","Ventura County Fire Department"
"17887","California Association of Health Facilities (oppose unless amended)"
"17888","Mariner Health Care (oppose unless amended)"
"17889","CA Association of Local Agency Formation Commissions [SPONSOR]"
"17890","Napa County Local Agency Formation Commission"
"17891","California Sexual Assault Investigators' Associations"
"17892","California Mortgage Association (Sponsor)"
"17893","California Health Insititute"
"17894","Western Fairs Association (Sponsor)"
"17895","Amador County Fair (26th DAA)"
"17896","California Exposition & State Fair"
"17897","California Mid-State Fair (16th DAA)"
"17898","Contra Costa County Fair (23rd DAA)"
"17899","Humboldt County Fair"
"17900","Modoc District Fair (34 DAA)"
"17901","Sacramento County Fair (52nd  DAA)"
"17902","San Benito County Fair (33rd DAA)"
"17903","Tehama District Fair (30th DAA)"
"17904","The Big Fresno Fair (21st DAA)"
"17906","Agricultural Commissioners and Sealers Association"
"17907","Campaign for Long Term Care"
"17908","Independent Living Services of Northern California (ILNSC)"
"17910","Service Employees International Union (SEIU), Local 434B (sponsor)"
"17912","California Association of Public Authorities (CAPA)"
"17913","County Welfare Directors Association of CA (CWDA)"
"17914","Personal Assistance Services Council of Los Angeles County (PASC)"
"17915","Southern California Regional Rail Authority (sponsor)"
"17916","County of Santa Clara (sponsor)"
"17917","California Primary Care Association (if amended)"
"17918","Apartment Association of California Southern Cities (Co-sponsor)"
"17919","Berkeley Property Owners Association (Co-sponsor)"
"17920","North Valley Property Owners Association"
"17921","California Housing Council, Inc."
"17922","California Chapter of the National Organization for Women"
"17923","Family Law Section of the State Bar"
"17924","California Association of Clerks and Election Officials (CACEO)"
"17925","MNBA America"
"17926","Boards of Supervisors of Fresno, Tulare, and Merced Counties"
"17927","California Association of Nurseries and Garden Centers(Sponsor)"
"17928","City of Rancho Santa Margarita"
"17929","Riverside County Farm Bureau"
"17930","Golden Gate Regional Center"
"17931","Bay Area Housing Corporation"
"17932","City of Campbell"
"17933","Community Development Department"
"17934","Charities Housing"
"17935","West Bay Housing Corporation"
"17936","Association for the Mentally Retarded at Agnews"
"17937","Isolation Products, Inc."
"17938","Keeping Our Families Together (KOFT)"
"17939","California WIC Association (source)"
"17940","Nutritional Grocers of California"
"17941","California Municipal Revenue and Tax Association"
"17942","Russian River Residents Against Unsafe Logging"
"17944","National Audubon Societys Peregrine Chapter of Mendocino County"
"17945","ONEgeneration (Sponsor)"
"17946","California Association of Adult Day Services"
"17947","Toyota, USA"
"17948","Association of California Life and Health Insurance Companies (ACLHIC) (Sponsor)"
"17949","Allergy and Asthma Network Mothers of Asthmatics"
"17950","California Business Properties Association (prior to author's amendments)"
"17951","Western Fairs Association  (prior to author's amendments)"
"17952","The City of Moreno Valley"
"17953","Aegis Medical Systems (co-source)"
"17954","California Opioid Maintenance Providers (co-source)"
"17955","California Society of Addiction Medicine (earlier version of bill)"
"17956","California Association of Alcohol Drug Program Executives, Inc. (earlier version of bill)"
"17957","California Attorneys for Criminal Justice (earlier version of bill)"
"17958","California Catholic Conference of Bishops (earlier version of bill)"
"17959","California Psychiatric Association (earlier version of bill)"
"17960","Drug Policy Alliance Network (earlier version of bill)"
"17961","County of Sacramento, Board of Supervisors"
"17962","Community Medical Centers of Fresno"
"17963","Safety BeltSafe USA"
"17964","UC Davis Medical Center Trauma Prevention Program"
"17965","HomeGuard (sponsor)"
"17966","Pacific Coast Federation of Fishermen (sponsor)"
"17967","Captain Sean Hodges, Fishing Vessel HogHeaven"
"17968","Crab Boat Owners Association"
"17969","Fisherman's Marketing Association of Bodega Bay"
"17970","Fishing Vessel, Sandra Sue"
"17972","Josh Churchman, Fishing Vessel Osprey"
"17973","Kurt Hochberg, Fishing Vessel New Salmon Queen"
"17974","Steven Kingsley, Sales Agent for Morgan Fish Company, San Francisco"
"17975","Humboldt Fishermen's Marketing Association, Inc."
"17976","National Electric Contractors' Association (source)"
"17977","California Building Industry Association (opposed to prior version)"
"17978","Jewish Family Services of Los Angeles Domestic Violence Project"
"17979","MANALIVE (Men Allied Nationally Against Living In Violent Environments)"
"17980","Sojourn Services for Battered Women and Their Children"
"17982","State Bar, Family Law Section (since amendment)"
"17983","San Bernardino County Board of Supervisors (source)"
"17986","California Association of Environmental Health Administrators"
"17987","NorCal Waste Distribution, Inc."
"17988","Solid Waste Association of North America (if amended)"
"17989","Vanished Children's Alliance"
"17990","Imperial County District Attorney"
"17991","Structural Settlement Coalition"
"17994","California School Employees Association (prior version)"
"17995","California State Employees Association (prior version)"
"17996","California Authority of Racing Fairs"
"17997","Fairplex/Los Angeles County Fair Association"
"17998","America Online, Inc."
"18000","Conference of Delegates of California Bar Associations (sponsor)"
"18001","Board of Barbering and Cosmetology (source)"
"18002","California Center for Law and the Deaf"
"18003","California School for the Deaf, Riverside"
"18004","State Bar Family Law Section"
"18006","Apartment Association of Greater Los Angeles (Co-Sponsor)"
"18007","Cabrillo Economic Development Corporation Saticoy"
"18008","California Alliance for Retired Americans, Berkeley"
"18009","Disabled Resources Center, Long Beach"
"18010","East Palo Alto Council of Tenants Education Fund"
"18011","Fair Housing Council of Riverside County"
"18012","Father Joe's Villages, San Diego"
"18013","First Community Housing, Inc., San Jose"
"18015","Renee Franken and Associates, Carmichael"
"18016","Fresno Interdenominational Refugee Ministries"
"18017","Fresno West Coalition for Economic Development"
"18018","Hillview Mental Health Center, Inc., Pacoima"
"18019","Inclusive Homes, Inc., Los Angeles"
"18020","La Raza Centro Legal, Inc., San Francisco"
"18021","Los Angeles Housing Partnership, Inc."
"18022","Mental Health Advocacy Services, Inc., Los Angeles"
"18024","Opportunities for Neighborhood Empowerment Company, Inc., Los Angeles"
"18025","Partners in Housing, Inc., Ventura"
"18026","Rubicon Programs, Inc., Richmond"
"18027","Rural Communities Housing Development Corporation, Ukiah"
"18028","Santa Cruz Affordable Housing Advocates"
"18029","Santa Monicans for Renters' Rights"
"18030","Shelter Inc. of Contra Costa County, Martinez"
"18031","Shelter Partnership, Inc., Los Angeles"
"18032","Southern California Housing Development Corporation, Rancho Cucamonga"
"18033","Vietnam Veterans of California - Sacramento Veterans Resource Center"
"18034","Women Organizing Resources, Knowledge and Services, Los Angeles"
"18035","West Hollywood Community Housing Corporation, West Hollywood"
"18036","WRJ Group, Inc., Fountain Valley"
"18037","California Association of Local Conservation Corps"
"18038","Tujunga Watershed Council and Stakeholders"
"18039","Livermore Legislative Education Group - letters of individual support"
"18040","Poway Unified Education Advocates - letters of individual support"
"18041","San Bernardino City Unified School District"
"18042","California Association of Health Facilities (if amended)"
"18044","California Association of Sheet Metal and Air Conditioning  Contractors"
"18045","California Automotive Wholesalers Association"
"18046","California Grape & Fruit Tree League"
"18048","Holiday Quality Foods"
"18049","Liberty Mutual Insurance Group"
"18054","Professional and Technical Engineers"
"18055","Cardinal Health and AmerisourceBergen (source)"
"18056","Asthma and Allergy Foundation of America"
"18057","The Southern California Chinese Lawyers Association (source)"
"18058","AK Consultants"
"18059","California Association of Immigration Consultants, Inc."
"18060","ECSA, A Private Immigration Agency"
"18063","\"You and Immigration,\" Immigration Services"
"18064","Guru Nanar Sat Sangat of California"
"18066","American Society for Dermatologic Surgery"
"18067","American Society for Mohs Surgery"
"18068","Girl Scouts Council of California"
"18069","Medical Oncology Association of Southern California, Inc."
"18070","Ann F. Haas, M.D., Senior Dermatologist, Sutter Medical Group"
"18071","William S. Graham Foundation for Melanoma Research, Inc."
"18072","Indoor Tanning Association"
"18074","International Smart Tan Network"
"18075","Turlock Irrigation District (source)"
"18077","Jackson Valley Irrigation District"
"18078","California Department of Insurance (source)"
"18081","LA Coalition to End Hunger & Homelessness"
"18082","Second Harvest Food Bank of Santa Cruz and San Benito Counties"
"18083","California Defense Counsel (sponsor)"
"18084","Asian Youth Center"
"18085","Children's Specialty Care Coalition"
"18086","Chinese American Political Action Committee"
"18087","Western Center of Law and Poverty"
"18088","California Alternative Payment Program"
"18089","CalTrade"
"18090","Valley Industry and Commerce Association (source)"
"18091","ACI Billing Services"
"18092","Chatsworth/Porter Ranch Chamber of Commerce"
"18093","Congressman Brad Sherman"
"18094","Granada Hills Chamber of Commerce"
"18095","The Honorable James K. Hahn, Mayor of Los Angeles"
"18096","Los Angeles City Councilmember Dennis Zine"
"18097","Los Angeles City Councilmember Greig Smith"
"18098","Los Angeles City Councilmember Tony Cardenas"
"18099","Los Angeles City Councilmember Wendy Greuel"
"18100","Small Manufacturer's Association of California"
"18101","Southland Regional Association of Realtors"
"18102","The Valley Group"
"18103","Insurance Commissioner (co-source)"
"18104","Equality California (co-source)"
"18105","Aids Project Los Angeles Metropolitan Community Church, Los Angeles"
"18106","Employment Law Center"
"18108","Lambda Legal Defense and Education Fund"
"18109","Southern California Regional Chapter of Pride at Work"
"18110","The San Francisco Lesbian Gay Bisexual Transgender"
"18111","Community Center Parents, Families, and Friends of Lesbian and Gays, Ventura County"
"18112","County of San Bernardino (Sponsor)"
"18113","Pacific Association of Building Service Contractors (source)"
"18114","Complete Building Maintenance Company"
"18116","Mr. Clean Maintenance Company"
"18118","Contractors State License Board (source)"
"18119","Association for Los Angeles Deputy Sheriffs (Sponsor)"
"18120","Los Angeles County Probation Officers Union (Co-Sponsor)"
"18121","Association of Motor Vehicle Investigators of California"
"18122","Los Altos Peace Officer's Association"
"18123","Oceanside Police Officers' Association"
"18124","California Chapter, American College of Emergency Physicians"
"18125","El Dorado County Board of Supervisors"
"18126","Commission on State Mandates"
"18127","California Association of Nurse Practitioners (source)"
"18128","American Nurse Association of California"
"18130","State Board of Registered Nursing"
"18131","California Healthcare Institute (Co-Sponsor)"
"18132","Steve Westly, State Controller"
"18133","State Teachers' Retirement System (source)"
"18134","Department of Finance (unless amended)"
"18135","California Bail Agents Association (source)"
"18136","Bad Boy Bail Bonds"
"18137","California Association of Law Enforcement Records Supervisors"
"18138","Golden State Bail Association"
"18139","Victor Valley Community College"
"18140","California Democratic Legislative Women's Caucus"
"18141","American Institute of Architects, California Council (sponsor)"
"18142","San Diego Unified Port"
"18143","Adelphia Communications"
"18144","California Cable and Telecommunications Association"
"18148","American Parkinson's Disease Association (co-source)"
"18149","Parkinson's Action Network (co-source)"
"18150","Dr. Jeff Bronstein, M.D., Ph.D., Director of Movement Disorder at UCLA School of Medicine"
"18152","National Parkinson's Disease Foundation"
"18153","Parkinson's Disease Association of San Diego"
"18154","Parkinson's Support Group of Sonoma County"
"18155","Parkinson's Unity Walk"
"18156","Sun Lakes Parkinson Support Group"
"18157","The Parkinson's Alliance:  Tuchman Foundation"
"18158","Young Onset Parkinson's Disease Association"
"18159","Insurance Agents & Brokers Legislative Council (sponsor)"
"18160","Progressive Insurance Company (sponsor)"
"18161","Allied Insurance"
"18162","Clean Harbors Environmental Services"
"18163","Safety-Kleen Corporation"
"18165","American Resort Development Association (source)"
"18166","Cendant Timeshare Resort Group, Inc."
"18168","Fairfield Resorts"
"18169","Hyatt Vacation Ownership, Inc."
"18170","Interval International"
"18171","Resort Condominiums International, LLC"
"18173","WorldMark, The Club"
"18174","Independent Waste Oil Collectors and Transporters (source)"
"18175","California Pepper Commission (sponsor)"
"18176","San Joaquin County (sponsor)"
"18179","Veterans of Foreign Wars of the United States, Department of California (source)"
"18180","Ladies Auxiliary to the Veterans of Foreign Wars of the United States, Kearny Mesa Post 3788, San Diego"
"18181","Alum Rock Union Elementary School District"
"18182","Health Trust"
"18183","The Bay Area Partnership"
"18184","West Contra Costa Unified School District"
"18185","Amador County Office of Education"
"18187","Brawley Union High School"
"18188","Colusa Unified School District"
"18189","Cucamonga School District"
"18191","Fortuna Union High School District"
"18192","Fountain Valley School District"
"18193","Hawthorne School District"
"18195","Klamath-Trinity Joint Union School District"
"18196","Modoc County SELPA"
"18197","Pioneer Union Elementary School District"
"18198","Placerville Union School District"
"18200","Sacramento County Board of Supervisors (prior version)"
"18202","Vallecito Union School District"
"18203","Yuba County Office of Education"
"18204","City of Compton (Resolution rescinded by act of City Council on April 13, 2004)"
"18205","Gabrielino-Tongva Tribal Council, headquartered in Santa Monica, CA (Sponsor)"
"18206","Delorise A. Anderson, Member, Board of Trustees, Compton Unified School District"
"18207","Jim Brown, President, The AMER-I-CAN Program"
"18208","Earl \"Skip\" Cooper II, President/Chief Executive Officer, Black Business Association"
"18209","Leslie A. Irving, Vice President, Board of Trustees, Compton Unified School District"
"18210","Muhammad Nassardeen, President/Founder Recycling Black Dollars Communications"
"18212","Ulis C. Williams, Superintendent/President, Compton College District"
"18213","Artichoke Joe's Casino"
"18214","Bicycle Club Casino"
"18215","Commerce Club Casino"
"18216","Gabrielino-Tongva San Gabriel Band of Mission Indians, headquartered in San Gabriel, CA"
"18217","Gabrielino-Tongva Indians of California, headquartered in Culver City, CA"
"18218","Normandie Club Casino"
"18219","Drug Policy Alliance (Sponsor)"
"18221","Abyssinian Missionary Baptist Church"
"18222","State Personnel Board (co-source)"
"18223","Statewide Disability Advisory Committee"
"18225","League of United Latin American Citizens, District XIII"
"18226","Appliance Recycling Centers of America (source)"
"18227","Institute of Scrap Recycling Industries"
"18228","Consolidated Irrigation District"
"18229","Casitas Municipal Water District"
"18230","City of Angels Camp"
"18231","Inyo County Board of Supervisors"
"18232","Inyo-Mono Fish and Game Advisory Commission"
"18233","Mono County Board of Supervisors"
"18234","Mono County Economic Development and Special Projects"
"18235","Sun City Roseville Rod and Reel Club"
"18236","United Angers Marine Resource and Conservation Program"
"18237","California Fly Fisher"
"18238","California Fly Fishers Unlimited"
"18239","Federation of Fly Fishers"
"18241","Shasta Mayflies"
"18242","15 Individuals"
"18243","California State Rural Health Association (source)"
"18244","Aspen Street Architects, Inc."
"18245","Bear Valley Community Healthcare District"
"18246","Colusa Regional Medical Center"
"18248","Modoc Medical Center"
"18249","North Coast Emergency Medical Services"
"18251","Ukiah Valley Primary Care Medical Group"
"18252","Mercy Medical Center Mt. Shasta"
"18253","Castle Family Health Centers"
"18254","California Alliance of Information and Referral Services (source)"
"18255","2-1-1 San Diego Coalition"
"18256","Area Agency on Aging"
"18257","California Child Care, Resource & Referral Network"
"18258","Community Health Improvement Partners"
"18259","Community Services Planning Council"
"18260","Community Technology Alliance"
"18262","El Dorado County Department of Human Services / AAA"
"18263","First 5 Riverside, Riverside County Children & Families Commission"
"18264","First Five Sacramento Commission"
"18265","HCAR"
"18267","Housing and Community Services Department, Office on Aging, Orange County"
"18268","Humboldt Area Foundation"
"18269","Humboldt Community Switchboard"
"18270","Info Line of San Diego County"
"18271","Info Link Orange County"
"18272","Interface Children Family Services"
"18273","Melvin F.& Grace McLean Foundation"
"18274","Mental Health Association in San Diego County"
"18275","Mother Lode Workforce Investment Board"
"18276","Northern California Council for the Community"
"18277","Orange County Department of Education"
"18278","Orange County United Way"
"18279","Reach Out"
"18280","Resource Center for Nonprofit Management"
"18282","San Diego Employers Association, Inc."
"18283","Society of St. Vincent de Paul"
"18284","Union Labor of Health Foundation"
"18285","United Way of Fresno"
"18286","United Way of Humboldt"
"18287","The United Way, San Diego County"
"18288","The United Way of Silicon Valley"
"18289","Volunteer Center, Orange County"
"18291","The Health Consumer Alliance"
"18292","Molina Healthcare of California"
"18293","Los Angeles County District Attorneys Office (source)"
"18294","Health Access (source)"
"18296","California Association of Physician Groups (unless amended)"
"18297","Health Net (unless amended)"
"18298","PacifiCare (unless amended)"
"18299","State Department of Managed Health Care (unless amended)"
