"organization_id","name"
"5061","Alta Irrigation District"
"5063","Association of Orange County Deputy Sheriffs"
"5064","Anaheim Police Officers Association"
"5066","State Coalition of Probation Organizations"
"5068","Howard Jarvis Taxpayers Association"
"5069","Orange County Taxpayers Association"
"5071","Amador Water Agency"
"5075","Mountain Counties Water Resources Association"
"5076","Placer County Water Agency"
"5078","Yuba County Water Agency"
"5079","Central Sierra Environmental Resource Center"
"5083","Planning and Conservation League"
"5089","Environment California (source)"
"5094","United Nurses Associations of California/Union of Health Care"
"5099","California Healthcare Association"
"5101","Community Hospital of San Bernardino"
"5102","Dominican Hospital"
"5103","Glendale Memorial Hospital and Health Center"
"5106","Mercy Medical Center Redding"
"5107","Northridge Hospital Medical Center, Sherman Way Campus"
"5108","Oak Valley Hospital District"
"5109","Saint Agnes Medical Center"
"5111","St. Elizabeth Community Hospital"
"5113","St. Joseph Health System - Humboldt County"
"5114","St. Joseph Health System - Sonoma County"
"5116","St. Jude Medical Center"
"5117","St. Vincent Medical Center"
"5118","Sequoia Hospital"
"5119","Sierra Nevada Memorial Hospital"
"5120","The California Manufacturers and"
"5126","Veterans for a Better Government"
"5129","California Association of Alcohol and Drug Program"
"5131","California Mental Health Directors Association"
"5132","California Psychiatric Association"
"5133","Living Word Christian Center International"
"5134","National Council on Alcoholism and Drug Dependence of the"
"5135","South Bay"
"5136","Urban Counties Caucus"
"5138","1 individual"
"5139","Attorney Service of San Francisco"
"5141","California Association of Health Plans"
"5143","ClearPrint"
"5144","Greenberg & Jackson: An Accountancy Corporation"
"5145","Health Net"
"5147","Instant Court Reporting"
"5148","Realty World Broker Network"
"5149","Richard Berman Software Technology Service"
"5150","79 individuals"
"5152","Automotive Aftermarket Services"
"5154","Biocom (San Diego)"
"5155","Building Industry Association of Tulare/Kings Counties"
"5156","Burnham Real Estate Services, Inc."
"5157","California Association of Independent Business, Inc."
"5158","California Business Properties Association"
"5159","California Chamber of Commerce"
"5160","California Industrial Services"
"5161","California Manufacturers and Technology Association"
"5162","CancerVax Corporation"
"5163","Central California Chamber Alliance"
"5164","Chico Chamber of Commerce"
"5165","Community Interface Services"
"5166","Creative Elegance (South El Monte)"
"5168","Encinitas Chamber of Commerce"
"5169","Flite Co. -Flight Management Services)"
"5170","Frontier Trading, Inc."
"5171","Gen-Probe Incorporated"
"5172","GRAYLIFT"
"5173","Greater Bakersfield Chamber of Commerce"
"5174","Greater Fresno Area Chamber of Commerce"
"5175","GreenfiX America (Calipatria)"
"5176","Guardian Industries, Corp."
"5178","Irvine Chamber of Commece"
"5179","Kas Engineering, Inc. (Santa Monica)"
"5180","Ken & Carol Maul, Realty Concepts"
"5181","L.W. Lefort -Engineers, Designers, Fabricators"
"5182","Lennar Partners"
"5183","Los Angeles County Board of Supervisors -Supports in part."
"5184","Luggage & Leather Goods"
"5185","Lumber Association of California and Nevada"
"5186","M & B Paper Products, Inc."
"5187","Modesto Chamber of Commerce"
"5190","Oasis Date Gardens (Thermanl)"
"5191","Pacific Home Do it Center (San Luis Obispo)"
"5192","Palm Desert Chamber of Commerce"
"5193","Paul Besselievre"
"5194","Redondo Beach Chamber of Commerce"
"5195","Senate Committee on Labor and Industrial Relations"
"5197","Robinson Manufacturing Inc."
"5198","Roseville Chamber of Commerce"
"5199","San Diego Regional Economic Development Corporation"
"5200","Santa Fe Springs Chamber of Commerce & Industrial League,"
"5202","Sun Valley Floral Farms"
"5203","Tulare Chamber of Commerce"
"5204","United Chambers of Commerce of the San Fernando Valley"
"5205","Valley Security + Alarm"
"5206","Ventura Chamber of Commerce"
"5207","Victorville Chamber of Commerce"
"5208","Vivaldi Consulting Group LLC"
"5210","Winterhaven Ranch (Huntington Beach)"
"5214","California Conference Board of the Amalgamated Transit"
"5216","California Conference of Machinists"
"5218","California Independent Public Employees Legislative Council"
"5220","California Professional Firefighters"
"5221","California Rural Legal Assistance Foundation"
"5224","Consumer Attorneys of California"
"5225","Engineers and Scientist of California, IFPTE Local 20,"
"5227","Hotel Employees & Restaurant Employees International Union"
"5228","Professional and Technical Engineers, IFPTE Local 21,"
"5229","Service Employees International Union"
"5230","United Food & Commercial Workers Region 8 States Council"
"5231","Associated Builders and Contractors of California"
"5233","Western Electrical Contractors Association, Inc."
"5234","California Independent Public Employee Legislative Council"
"5237","Greater Riverside Chambers of Commerce"
"5238","Irvine Chamber of Commerce"
"5239","CalTax"
"5240","California Tax Reform Association"
"5246","Senate Republican Caucus"
"5247","Attorney General"
"5248","American Lung Association of California"
"5249","California Independent Grocers and Convenience Stores"
"5253","California Language Teachers Association"
"5254","Faculty Association of California Community Colleges"
"5255","Department of Finance"
"5256","Trusts and Estates Section of the State Bar of California"
"5258","Congress of California Seniors"
"5259","Coalition for Quality Credit Counseling"
"5260","Privacy Rights Clearinghouse"
"5261","California Association of Clerks and Election Officials"
"5262","California Foundation for Independent Living Centers"
"5264","California Building Industry Association"
"5265","Californians for Disability Rights, Inc."
"5266","Fair Housing of Marin"
"5267","Housing California"
"5269","Sacramento Housing Alliance"
"5270","Southern California Housing Rights Center"
"5271","State Attorney General"
"5272","Western Center on Law and Poverty"
"5273","Western United Dairymen"
"5277","California Bankers Association"
"5281","Los Angeles County Federation of Labor"
"5282","Dairy Institute"
"5283","Kraft Foods North America"
"5284","Agricultural Council of California"
"5285","Alliance of Western Milk Producers"
"5286","California Dairy Campaign"
"5287","California Dairy Women Association"
"5288","California Farmers Union"
"5289","Community Alliance With Family Farmers"
"5291","Fifteen Individuals"
"5292","City of West Sacramento"
"5293","Los Angeles County Board of Education"
"5294","California Dump Truck Owners Association"
"5295","California Tow Trucking Association"
"5296","California Trucking Association"
"5298","Los Angeles Alliance for a New Economy"
"5300","Costco Wholesale"
"5301","L.A. Fitness International, LLC"
"5303","Mark Development"
"5306","California Assessors Association (source)"
"5307","State Department of Finance"
"5310","California Youth Connection"
"5311","Hon. Muriel P. Johnson, Supervisor, Sacramento County"
"5312","Mansfield Ink"
"5313","One individual"
"5314","State Board of Equalization (source)"
"5315","Franchise Tax Board (source)"
"5319","State Franchise Tax Board (source)"
"5320","Franchise Tax Board"
"5321","State Treasurer Phil Angelides (source)"
"5323","California Attorneys of California"
"5324","Engineers and Scientists of California"
"5325","United Food and Commercial Workers, Region 8 States Council"
"5326","Hotel Employees, Restaurant Employees International Union"
"5327","Professional and Technical Engineers, Local 20 & 21"
"5328","PORAC"
"5329","California Association of Highway Patrolmen"
"5332","State Department of Forestry Firefighters."
"5333","CA Federation of Republican Women"
"5334","CA Special Districts Association"
"5336","North Coast Railroad Authority [SPONSOR]"
"5337","California Coalition of Fuel Cell Manufactures"
"5338","Clean Power Campaign"
"5341","California Manufactures and Technology Association (CMTA)"
"5342","California Power Partners"
"5343","Capstone Turbine Corporation"
"5344","Carrier Corporation"
"5345","Clarus Energy"
"5347","Edward B. Ward Company"
"5348","Gas Turbine Association"
"5351","Valley Detroit Diesel Allison"
"5353","United Technologies Corporation"
"5355","Engine Manufacturers Association"
"5357","Renewable Energy Investments"
"5358","US Airconditioning Distributors"
"5359","San Leandro Branch of Carrier Corporations"
"5360","State Department of Finance (source)"
"5361","Secretary of State"
"5363","California Association of Homes and Services for the Aging"
"5364","California Continuing Care Residents Association"
"5365","Health Rights Hotline"
"5366","Board of Podiatric Medicine"
"5367","California Association of Bioanalysts"
"5368","California Clinical Laboratory Association"
"5369","Palo Alto Medical Foundation"
"5370","Board of Behavioral Sciences"
"5371","California Society of Pathologists"
"5372","State Department of Consumer Affairs (source)"
"5377","Ability First"
"5384","Asian Pacific Policy & Planning Council"
"5389","Barrio Planners Inc."
"5390","Bassett Unified School District"
"5391","California Academy of Family Physicians"
"5392","California Ambulance Association"
"5393","California Association of Physician Groups California"
"5396","California Catholic Conference"
"5397","California Council on Alcohol Problems"
"5398","California Emergency Nurses Association"
"5401","California Society of Anesthesiologists, Inc."
"5402","CHARO Community Development Corp."
"5404","City of Huntington Park"
"5405","City of La Puente"
"5407","East Los Angeles Community Youth Center"
"5409","Emergency Medical Services"
"5413","Hacienda La Puente Unified School District"
"5416","Imperial County Medical Society"
"5417","International Brotherhood of Electrical"
"5418","Workers Local Union 11"
"5421","Los Angeles County Board of Supervisors"
"5422","Maravilla Community Advisory Committee"
"5423","Motion Picture Studio Grips, Local 80"
"5424","Napa County Medical Society"
"5425","Painters & Allied Trades District Council 36"
"5426","Plaza Community Center"
"5427","Riverside Sheriffs Association"
"5432","Sierra Sacramento Valley Medical Society"
"5433","Solano County Medical Society"
"5434","Sonoma County Medical Association"
"5435","TELACU"
"5436","Tri-City Mental Health Center"
"5437","Seven individuals"
"5440","Bay Area Beverage Company"
"5443","California Alliance for Consumer Protection California"
"5446","California Beer & Beverage Distributors"
"5447","California Beverage Merchants"
"5449","California Hotel and Lodging Association"
"5454","California Restaurant Association"
"5456","California Small Brewers Association"
"5457","Central Coast Distributing"
"5459","Couch Distributing Company, Inc."
"5462","Family Winemakers of California"
"5463","Gate City Beverage"
"5464","Golden Gate Restaurant Association"
"5466","House of Daniels, Inc."
"5471","Mission Beverage Co."
"5472","Nor-Cal Beverage Co., Inc."
"5473","Otra Beer"
"5474","Recovery California Coalition"
"5477","Stash Distributing, Inc."
"5479","Tri-Eagle Beverage"
"5480","V. Santoni & Company"
"5482","Four Individuals"
"5484","Medical Board of California"
"5485","State Board of Accountancy"
"5486","Blood Centers of California (source)"
"5487","Bio-Medics Plasma Center"
"5488","Cangene Plasma Centers"
"5489","Contra Costa County Board of Supervisors"
"5490","Office of the State Attorney General"
"5491","California Highway Patrol"
"5492","Orange County Transportation Authority"
"5493","Metropolitan Transportation Commission"
"5494","California Fire Chiefs Association"
"5495","Fire Districts Association of California"
"5496","California State Automobile Association"
"5497","City of Palo Alto"
"5498","Stanford University"
"5499","Association of Independent California Colleges and Universities"
"5500","Surface Transportation Policy Project (source)"
"5501","Absolute Bail Bonds"
"5502","Bay Area Bicycle Coalition"
"5503","BayRail Alliance"
"5504","California ACORN"
"5505","California Bicycle Coalition"
"5506","California Center for Public Health Advocacy"
"5507","California Futures Network"
"5508","California Park and Recreation Safety"
"5509","California Park and Recreation Society"
"5510","California State PTA"
"5511","City of Fresno - Public Works Department"
"5513","Cities of Anderson, Artesia, Atwater, Cathedral City,"
"5514","Claremont, Concord, Covina, Fontana, Fremont, La Habra,"
"5515","Laguna Beach, Lancaster, Mill Valley, Monrovia, Morgan"
"5516","Hill, Rancho Cucamonga, Rosemead, Sanger, San Diego, San"
"5517","Pablo, Santa Barbara, San Bernardino, San Leandro, Santa"
"5520","Community Traffic Safety Coalition of Santa Cruz County"
"5521","Contra Costa Childhood Injury Prevention Coalition"
"5522","County of Fresno, Board of Supervisors, District 3"
"5523","Counties of Marin, Orange, and San Diego"
"5524","Ecumenical Association for Housing"
"5525","Fairfax Safe Routes to School"
"5526","Los Angeles County Bicycle Coalition"
"5528","Marin County Bicycle Coalition"
"5529","Marin County Board of Supervisors"
"5531","Nate Miley, Alameda County Supervisor"
"5534","Presidio MS PTSA"
"5535","Rails To Trials Conservancy"
"5536","Safe Routes to School:  Marin County Pubic Works"
"5537","San Diego Association of Governments"
"5538","San Diego Safe Kids Coalition"
"5539","San Francisco Bicycle Coalition"
"5540","Santa Cruz County Regional Transportation Commission"
"5541","School Traffic and Pedestrian Safety Improvement Project"
"5542","Silicon Valley Manufacturing Group"
"5543","Sonoma County Bicycle Coalition"
"5544","Strategic Alliance"
"5545","The Access Center of Imperial Valley"
"5546","The Association of EOP Directors"
"5547","The Local Government Commission"
"5548","Transportation and Land Use Corporation"
"5549","Urban Ecology"
"5550","WalkSacramento"
"5551","American Council of Gift Annuities"
"5552","Atherton Baptist Homes"
"5553","California Polytechnic State"
"5554","California State University"
"5555","Chapman University"
"5556","Northern California Planned Giving Council"
"5566","San Francisco Symphony"
"5568","The Claremont School of Theology"
"5569","The Episcopal Diocese of California"
"5574","California Department of Insurance"
"5575","City of Laguna Beach"
"5576","Attorney General (source)"
"5579","State Controller"
"5580","State Treasurer"
"5581","California Mobilehome Resource and Action Association"
"5582","Golden State Manufactured-Home Owners League, Inc."
"5583","State Controller Steve Westly"
"5585","CA Association of Recreation and Park Districts"
"5586","CA Association of Resource Conservation Districts"
"5587","CA Municipal Utilities Association"
"5588","CA Public Securities Association"
"5589","County of Sacramento"
"5590","East Bay Municipal Water District"
"5591","League of CA Cities"
"5592","Mosquito and Vector Control Association of CA"
"5594","State Association of County Auditors"
"5595","Acclamation Risk Management Services"
"5596","California Apartment Association"
"5597","California Hotel & Lodging Association"
"5598","Compensation Risk Managers"
"5599","Flasher Barricade Association"
"5600","Independent Waste Oil Collectors and Transporters"
"5601","Insurance Agents and Brokers Legislative Council"
"5603","Affinity Group Administrators"
"5604","California-Nevada Conference of Operating Engineers"
"5605","Engineers and Scientist of California"
"5606","Professional and Technical Engineers, Local 21"
"5608","Transport Workers Union of America"
"5609","Flasher/Barricade Association"
"5610","California Law Review Commission (source)"
"5611","Coyote Valley Band of Pomo Indians"
"5612","Fort Mojave Indian Tribe"
"5613","Buena Vista Rancheria of Me-Wuk Indians"
"5614","Ewiiaapaayp Band of Kumeyaay Indians"
"5615","San Manuel Band of Mission Indians"
"5616","California Coalition on Donation (sponsor)"
"5617","California Transplant Donor Network"
"5618","Golden State Donor Services"
"5620","Culver City Fire Department"
"5621","Lake Shastina Community Services District"
"5622","Penn Valley Fire Protection District"
"5623","Escalon Fire Department"
"5624","Escondido Fire Department"
"5625","Carpinteria-Summerland Fire Protection District"
"5626","Alpine Fire Protection District"
"5627","San Mateo Fire Department"
"5628","Atascadero Fire Department"
"5629","Riverside Fire Department"
"5630","Lake Valley Fire Protection District"
"5632","Fire Chiefs Association of Santa Barbara County"
"5633","Sacramento County Fire Chiefs Association"
"5634","Painted Cave Fire Department"
"5636","County of Santa Barbara Fire Department"
"5637","Meeks Bay Fire Protection District"
"5638","Nevada County Consolidated Fire District"
"5639","North County Fire Authority"
"5640","Capistrano Unified School District"
"5642","Los Angeles County Office of Education"
"5643","Santee School District"
"5644","Riverside County Schools Advocacy Association"
"5645","Coalition for Adequate Housing"
"5646","California Law Revision Commission (sponsor)"
"5647","California Transit Authority (source)"
"5648","Santa Clara Valley Transportation Authority"
"5649","CH2MHILL, Chula Vista City Council, City of"
"5650","Poway, Riverside County Board of Supervisors,"
"5651","Santa Ana Watershed Project Authority"
"5652","County of Lake Probation Department"
"5653","County of Lake, Board of Supervisors"
"5654","Lake County Office of Education"
"5655","Lakeport Unified School District"
"5656","California State Floral Association"
"5657","California Cut Flower Commission"
"5658","Holt Transportation, Inc."
"5659","The Sun Valley Group (Sun Valley Floral Farms)"
"5660","State Department of Transportation"
"5661","Lake County (source)"
"5662","Regional Council of Rural Counties"
"5666","Small School Districts Association"
"5667","State Treasurer Philip Angelides"
"5669","American Planning Association - California Chapter"
"5670","California Redevelopment Association"
"5673","Counties of Orange, Sacramento"
"5674","Orange County Supervisor Chris Norby"
"5675","Sacramento County Sheriff Lou Blanas"
"5678","UFCW Local 770, Hollywood"
"5679","UFCW Local 839, Salinas"
"5680","UFCW Local 1179, Contra Costa County"
"5681","Alliance of Automobile Manufacturers"
"5682","American Capitol Management"
"5683","California Alliance For Consumer Protection"
"5684","California Motor Car Dealers Association"
"5685","Cities of Sacramento, Signal Hill"
"5686","International Mass Retail Association"
"5688","with the Million Mom March (co-source)"
"5689","Coalition to Stop Gun Violence (co-source)"
"5690","Firearms Law Center"
"5691","Placer County District Attorney"
"5692","Los Angeles District Attorney"
"5693","American Academy of Pediatrics"
"5694","Trauma Foundation"
"5695","State Department of Justice"
"5698","Safari Club"
"5699","California Rifle and Pistol Association"
"5700","Citizens Committee for the Right to Keep and Bear Arms"
"5702","Albertsons"
"5703","Canyon Hills Club, Anaheim Hills"
"5704","Do it center -Chatsworth"
"5706","ManagEase -Anaheim"
"5707","Ralphs Grocery Company"
"5708","Valley Crest Residential Care"
"5709","Wilson Automotive Group"
"5711","Peace Officers Research Association of California"
"5713","California State Employees Association"
"5714","AIDS Healthcare Foundation"
"5715","California Alliance for Retired Americans"
"5716","California Public Interest Research Group"
"5717","California Seniors Coalition"
"5718","Consumers Federation of California"
"5720","Gray Panthers California"
"5722","Health Access California"
"5724","Keenan and Associates"
"5725","Lambda Letters Project"
"5726","Lt. Governor Cruz Bustamante"
"5727","San Joaquin County Commission on Aging"
"5728","United Nurses Associations of California/Union of Health"
"5732","Bayer Healthcare Corporation"
"5736","California Pharmacists Association"
"5737","California Resource Institute"
"5738","Novartis Pharmaceuticals Corporation"
"5739","Pharmaceutical Research and Manufacturers of America"
"5740","TMJ Society of California"
"5741","Wyeth Pharmaceuticals"
"5742","Western Manufactured Housing Communities Association (Sponsor)"
"5743","Golden State Manufactured Home Owners League"
"5744","County of Santa Barbara"
"5745","San Luis Obispo County"
"5747","Attorney General of California"
"5748","California Commission on Aging"
"5749","California Latino Medical Association"
"5752","Consumer Federation of California"
"5753","Latino Coalition for a Health California"
"5755","Retired Public Employees Association"
"5756","Santa Clara County Board of Supervisors"
"5757","Senior Action Network"
"5758","United Nurses Association of California/Union of Health"
"5759","Care Professionals"
"5760","Boehringer Ingelheim Pharmaceuticals, Inc."
"5762","California Healthcare Institute Citizens Against Law Suit"
"5763","Abuse, San Joaquin County Chapter"
"5764","Eli Lilly and Company"
"5765","Hepatitis C Global Foundation"
"5766","Latino Behavioral Health Institute"
"5769","Seniors Coalition"
"5770","Western Center on Law and Poverty (source)"
"5771","Affordable Housing Alliance, San Francisco"
"5772","Agora Group, Goleta"
"5773","Beacon Housing, Los Angeles"
"5775","Cabrillo Economic Development Corp, Saticoy"
"5776","California Affordable Housing Law Project"
"5777","California Church IMPACT"
"5778","California Council of the Blind"
"5779","California Legislative Council for Older Americans"
"5780","California Partnership, Downey"
"5781","California Reinvestment Coalition"
"5782","Center for Community Advocacy, Salinas"
"5783","Central City SRO Collaborative, San Francisco"
"5784","Chicano Consortium"
"5785","Civic Center Barrio Housing Corporation, Santa Ana"
"5786","Coalition for Economic Survival, Los Angeles"
"5787","Community Housing Improvement Program, Chico"
"5788","Congregations Building Community, Modesto"
"5789","Council of Churches of Santa Clara County, Cupertino"
"5790","East Palo Alto Council of Tenants, East Palo Alto"
"5791","Emergency Housing Consortium, San Jose"
"5793","Esperanza Community Housing Corporation, Los Angeles"
"5794","Fair Housing Council of Riverside , Riverside"
"5795","First Community Housing Inc, San Jose"
"5796","Fisher Sehgal Yanez Architects, Los Angeles"
"5797","Fresno Interdenominational Refugee Ministries, Fresno"
"5798","Fresno West Coalition for Economic Development, Fresno"
"5799","Golden State Mobilehome Owners League, Chapter 24, East"
"5800","Palo Alto"
"5801","Greenlining Institute, Oakland"
"5802","Hillview Mental Health Center Inc, Pacoima"
"5803","Housing Leadership Council of San Mateo County"
"5804","Housing Rights Center, Los Angeles"
"5805","Housing Rights Committee of San Francisco"
"5806","Human Rights/Fair Housing Commission of the City and"
"5807","Inclusive Homes Inc, Los Angeles"
"5808","Inquilinos Unidos, Los Angeles"
"5809","JERICHO:  A Voice for Justice"
"5810","La Raza Centro Legal Inc, San Francisco"
"5811","Loaves and Fishes, Sacramento"
"5812","Los Angeles Housing Law Project, Los Angeles"
"5813","Los Angeles Housing Partnership Inc, Los Angeles"
"5814","Mental Health Advocacy Services Inc, Los Angeles"
"5815","Mid-Peninsula Housing Coalition, Redwood City"
"5816","Neighborhood Housing Services of Orange County"
"5818","Nightingale Manor, Palm Springs"
"5819","O.N.E. Company, Los Angeles"
"5820","Orange County Community Housing Corporation"
"5821","Partners in Housing Inc, Ventura"
"5823","Planning for Elders, San Francisco"
"5824","Protection and Advocacy"
"5825","Public Advocates"
"5826","Public Law Center, Santa Ana"
"5827","Renee Franken and Associates, Sacramento"
"5828","Rubicon Programs, Inc, Richmond"
"5829","Rural Communities Housing Development Corp, Ukiah"
"5830","Sacramento Neighborhood Housing Services"
"5831","Saint Vincent de Paul Village, San Diego"
"5832","San Francisco Homeless Senior Task Force"
"5833","Sanders and Associates, Barbara, Oakland"
"5834","Santa Cruz Affordable Housing Advocates, Santa Cruz"
"5835","Senior Action Network, San Francisco"
"5836","Shelter Inc of Contra Costa County"
"5837","Shelter Partnership Inc, Los Angeles"
"5838","Skid Row Housing Trust, Los Angeles"
"5839","Southern California Association of Non-Profit Housing"
"5842","Southern California Indian Center, Inc., Fountain Valley"
"5843","Strategic Actions for a Just Economy, Los Angeles"
"5844","Tenderloin Housing Clinic, San Francisco"
"5845","Valley Housing Foundation, Pacoima"
"5846","Vietnam Veterans of California - Sacramento Veterans"
"5848","W.O.R.K.S., Los Angeles"
"5850","WRJ Group Inc, Fountain Valley"
"5851","World Savings (source)"
"5852","California Credit Union"
"5853","Youth Law Center (Sponsor)"
"5854","California Coalition for Youth"
"5855","Commonweal"
"5856","Faith Communities for Families and Children"
"5857","Judicial Council of California"
"5858","Juvenile Court Judges of California"
"5860","One private citizen"
"5861","California District Attorneys Association"
"5862","City of Los Angeles (source)"
"5864","California Police Chiefs Association"
"5865","Coalition to Stop Gun Violence"
"5866","Legal Community Against Gun Violence"
"5867","Los Angeles Mayor James Hahn"
"5869","California Waterfowl Association"
"5870","National Association of Firearms Retailers"
"5871","Safari Club International"
"5873","Several individuals"
"5874","California Agricultural Commissioners and Sealers"
"5876","El Dorado Winery Association"
"5877","Hummingbird Hill Vineyards - Santa Rosa"
"5878","Marine Municipal Water District"
"5879","Napa County"
"5880","Napa County Farm Bureau"
"5881","Napa Valley Grape Growers Association"
"5882","North Coast Wine Growers - Sonoma County"
"5883","Pentimento Vineyards - Glen Ellen"
"5884","Saintsbury Winery - Napa"
"5886","Sonatera Vineyard"
"5887","Sonoma County Board of Supervisors"
"5888","Sonoma County Grape Growers Association"
"5889","The Environmental Action Committee of West Marin"
"5890","Tilbury Vineyards - Sebastopol"
